{
  "member_label": "Member 1",
  "shape": "hollow rectangular",
  "b": 100,
  "d": 200,
  "t1": 4,
  "t2": 3,
  "Ly": 2,
  "Lz": 2,
  "welded": "No",
  "design_class": "Class C",
  "product": "EP",
  "end_post_rigidity": "No_end_post",
  "stiff_bearing": "Type (c)",
  "khw": 1,
  "khf": 1,
  "Ss": 50,
  "a_st": 2000,
  "a_w": 0,
  "c": 50,
  "F_Ed": 30,
  "Mz": 7.5,
  "My": 2.5,
  "Mx": 0,
  "Vy": 5,
  "Vz": 3.5,
  "Nc": 12,
  "Nt": 22,
  "gamma_M1": 1.1,
  "gamma_M2": 1.25,
  "k": 0.9,
  "Kz": 1,
  "Ky": 1,
  "Kt": 1,
  "uid": "2606-eu-aluminium-design",
  "current_unit_system": "metric",
  "project_details": {
    "project_company": "",
    "project_name": "",
    "project_designer": "",
    "project_id": "",
    "project_client": "",
    "project_notes": ""
  }
}